{
  "skill": "dialectical-autocoder",
  "bundle_version": "1.0.0",
  "version_id": "dialectical-autocoder@1.0.0+sha256_65e31d4f",
  "bundle_hash": "sha256:65e31d4f33f00f662e5f9b3a7f1006928fdc6ccb0b77bf5ed45ca4739a9c1bda",
  "source": {
    "repo": "agentbootup",
    "commit": "ea0d3c2",
    "generated_at": "2026-05-25T21:38:09-05:00"
  },
  "distribution": {
    "mode": "self_apply"
  },
  "install": {
    "state_file": ".ai/skills/state/dialectical-autocoder.json",
    "backup_root": ".ai/skills/backups/dialectical-autocoder"
  },
  "validation": {
    "commands": []
  },
  "mutations": [],
  "files": [
    {
      "source": ".claude/skills/dialectical-autocoder/SKILL.md",
      "target": ".claude/skills/dialectical-autocoder/SKILL.md",
      "kind": "skill",
      "required": true,
      "role": "entrypoint"
    },
    {
      "source": ".claude/skills/dialectical-autocoder/reference.md",
      "target": ".claude/skills/dialectical-autocoder/reference.md",
      "kind": "skill",
      "required": false,
      "role": "reference"
    }
  ]
}
