{
  "skill": "info-processor",
  "bundle_version": "1.0.0",
  "version_id": "info-processor@1.0.0+sha256_9362ed0b",
  "bundle_hash": "sha256:9362ed0b592593e38d958f33ddd568a76472924c715bcdd593fe96606e912104",
  "source": {
    "repo": "agentbootup",
    "commit": "ea0d3c2",
    "generated_at": "2026-05-25T21:38:09-05:00"
  },
  "distribution": {
    "mode": "self_apply"
  },
  "install": {
    "state_file": ".ai/skills/state/info-processor.json",
    "backup_root": ".ai/skills/backups/info-processor"
  },
  "validation": {
    "commands": []
  },
  "mutations": [],
  "files": [
    {
      "source": ".claude/skills/info-processor/SKILL.md",
      "target": ".claude/skills/info-processor/SKILL.md",
      "kind": "skill",
      "required": true,
      "role": "entrypoint"
    }
  ]
}
