{
  "skill": "user-story-generator",
  "bundle_version": "1.0.0",
  "version_id": "user-story-generator@1.0.0+sha256_09e260e9",
  "bundle_hash": "sha256:09e260e9cd44a2d9c2b00c35357b61e93ea6ed8c9353e134efaa4197d19c5d74",
  "source": {
    "repo": "agentbootup",
    "commit": "ea0d3c2",
    "generated_at": "2026-05-25T21:38:09-05:00"
  },
  "distribution": {
    "mode": "self_apply"
  },
  "install": {
    "state_file": ".ai/skills/state/user-story-generator.json",
    "backup_root": ".ai/skills/backups/user-story-generator"
  },
  "validation": {
    "commands": []
  },
  "mutations": [],
  "files": [
    {
      "source": ".claude/skills/user-story-generator/SKILL.md",
      "target": ".claude/skills/user-story-generator/SKILL.md",
      "kind": "skill",
      "required": true,
      "role": "entrypoint"
    },
    {
      "source": ".claude/skills/user-story-generator/reference.md",
      "target": ".claude/skills/user-story-generator/reference.md",
      "kind": "skill",
      "required": false,
      "role": "reference"
    }
  ]
}
