{
  "skill": "runbook-generator",
  "bundle_version": "1.0.0",
  "version_id": "runbook-generator@1.0.0+sha256_74371154",
  "bundle_hash": "sha256:74371154d0fd58163335479353ccc833d86cc45906073ac8e1eff4674556915f",
  "source": {
    "repo": "agentbootup",
    "commit": "ea0d3c2",
    "generated_at": "2026-05-25T21:38:09-05:00"
  },
  "distribution": {
    "mode": "self_apply"
  },
  "install": {
    "state_file": ".ai/skills/state/runbook-generator.json",
    "backup_root": ".ai/skills/backups/runbook-generator"
  },
  "validation": {
    "commands": []
  },
  "mutations": [],
  "files": [
    {
      "source": ".claude/skills/runbook-generator/SKILL.md",
      "target": ".claude/skills/runbook-generator/SKILL.md",
      "kind": "skill",
      "required": true,
      "role": "entrypoint"
    },
    {
      "source": ".claude/skills/runbook-generator/reference.md",
      "target": ".claude/skills/runbook-generator/reference.md",
      "kind": "skill",
      "required": false,
      "role": "reference"
    }
  ]
}
