{
  "skill": "task-processor-auto",
  "bundle_version": "1.0.0",
  "version_id": "task-processor-auto@1.0.0+sha256_49d35afe",
  "bundle_hash": "sha256:49d35afe798b3f232be0c3b0a6a91645c808b639f15fdc187ce59764de36d5e3",
  "source": {
    "repo": "agentbootup",
    "commit": "ea0d3c2",
    "generated_at": "2026-05-25T21:38:09-05:00"
  },
  "distribution": {
    "mode": "self_apply"
  },
  "install": {
    "state_file": ".ai/skills/state/task-processor-auto.json",
    "backup_root": ".ai/skills/backups/task-processor-auto"
  },
  "validation": {
    "commands": []
  },
  "mutations": [],
  "files": [
    {
      "source": ".claude/skills/task-processor-auto/SKILL.md",
      "target": ".claude/skills/task-processor-auto/SKILL.md",
      "kind": "skill",
      "required": true,
      "role": "entrypoint"
    },
    {
      "source": ".claude/skills/task-processor-auto/reference.md",
      "target": ".claude/skills/task-processor-auto/reference.md",
      "kind": "skill",
      "required": false,
      "role": "reference"
    }
  ]
}
